{"alertsAllowed":false,"blockingReasons":["BACKTEST_NOT_RUN","CURRENT_TICKER_MAP_SURVIVORSHIP_BIAS","DELIVERY_DISABLED_BY_POLICY","EMAIL_SECRETS_MISSING","LIVE_EXPERIMENTAL_ROLLING_WINDOW","QUALITY_GATE_NOT_PASS","ROLLING_WINDOW_AMENDMENT_PREDECESSOR_MISSING","SCORING_METHODOLOGY_INCOMPLETE","SECTOR_RS_PROXY_SPY","SEC_QUARANTINE_ROWS_EXCLUDED","TELEGRAM_SECRETS_MISSING","YAHOO_MARKET_DATA_FALLBACK"],"channels":{"email":{"configured":false,"enabled":true,"failureCount":0,"lastSuccessAt":null,"lastTestAt":null,"recipientMasked":null},"telegram":{"configured":false,"enabled":true,"failureCount":0,"lastSuccessAt":null,"lastTestAt":null,"recipientMasked":null}},"environment":"production","generatedAt":"2026-09-09T20:09:24.773212Z","policy":{"alertTypes":["MAJOR_INSIDER_BUY","STEALTH_ACCUMULATION","TURNING"],"cooldownDays":14,"deliveryEnabled":false,"minimumSeverity":"WATCH","quietHours":null,"timezone":"Europe/Zagreb"},"schemaVersion":"1.0.0"}
